video_id,title,published,view_count,like_count,comment_count,duration,definition,tags,default_audio_language,madeforkid,channel_id,channelTitle
vsWrXfO3wWw,Machine Learning Tutorial Python - 4: Gradient Descent and Cost Function,2018-07-22T02:38:26Z,558342,8441,681,PT28M26S,hd,"['machine learning gradient descent example', 'python gradient descent implementation', 'gradient descent implementation in python', 'cost function machine learning', 'gradient descent algorithm', 'gradient descent linear regression python', 'gradient descent machine learning', 'gradient descent', 'gradient descent python', 'cost function', 'gradient decent', 'what is gradient descent', 'gradient descent linear regression', 'gradient descent in machine learning', 'Gradient descent simple explanation']",en,False,UCh9nVJoWXmFb7sLApWGcLPQ,codebasics
R-AG4-qZs1A,Introduction | NLP Tutorial For Beginners In Python  -  Season 1 Episode 1,2022-01-22T14:00:10Z,263933,4859,147,PT10M7S,hd,"['yt:cc=on', 'natural language processing python', 'nlp tutorial', 'nlp python', 'nlp', 'nlp in python', 'what is natural language processing', 'nlp tutorial for beginners', 'nlp for beginners', 'natural language processing tutorial', 'natural language processing training', 'nlp neural network tutorial', 'nlp machine learning tutorial', 'nlp projects', 'nlp training', 'natural language processing basics', 'nlp machine learning python', 'NLP course', 'NLP Tutorial', 'NLP learning path', 'how to clear nlp interviews']",en,False,UCh9nVJoWXmFb7sLApWGcLPQ,codebasics
pXGBHV3y8rs,"Gradient Descent For Neural Network | Deep Learning Tutorial 12 (Tensorflow2.0, Keras & Python)",2020-08-14T17:35:49Z,141096,3569,308,PT41M34S,hd,"['gradient descent neural network', 'gradient descent neural network example', 'gradient descent neural network explained', 'gradient descent how neural networks learn', 'gradient descent', 'gradient descent deep learning', 'what is gradient descent in deep learning', 'deep learning gradient descent', 'what is gradient descent in neural network', 'gradient descent in tensorflow', 'gradient descent in keras', 'deep learning gradient descent tutorial', 'gradient descent in deep learning']",en,False,UCh9nVJoWXmFb7sLApWGcLPQ,codebasics
-0NwrcZOKhQ,Python Pandas Tutorial 4: Read Write Excel CSV File,2017-02-04T19:56:28Z,656767,8778,505,PT27M3S,hd,"['pandas excel', 'python pandas excel', 'pandas csv', 'python pandas csv', 'pandas excel tutorial', 'pandas csv tutorial', 'pandas read_csv', 'pandas to_csv', 'pd read_csv', 'pandas write csv', 'python read excel', 'python csv tutorial', 'python write csv', 'python excel', 'pandas write', 'pandas read excel', 'pandas write excel', 'pandas read csv', 'how to read csv file in python', 'read csv file in python', 'csv python', 'pandas read csv file', 'how to read csv file in pandas', 'read csv file in pandas']",en,False,UCh9nVJoWXmFb7sLApWGcLPQ,codebasics
zB0Ap_SlVao,Future of data science jobs,2022-05-05T15:30:10Z,147743,7671,104,PT50S,hd,"['data science course', 'data science', 'data science for beginners', 'data science job', 'data science jobs', 'future of data science', 'future of data science jobs', 'future scope of data science', 'data science career', 'data scientist jobs', 'data scientist', 'data scientist career']",en,False,UCh9nVJoWXmFb7sLApWGcLPQ,codebasics
Fuw0wv3X-0o,"Word embedding using keras embedding layer | Deep Learning Tutorial 40 (Tensorflow, Keras & Python)",2021-03-24T14:30:01Z,56506,1223,55,PT21M35S,hd,"['yt:cc=on', 'keras embedding layer', 'word embedding tutorial', 'word embedding using keras embedding', 'word embedding', 'word embedding deep learning', 'embedding layers', 'what are embedding layers in keras', 'embedding layers in keras', 'word embedding using keras', 'word embedding keras tutorial', 'implementing word embedding', 'embedding layer keras', 'embedding as a layer', 'word embedding tensorflow', 'word embedding keras', 'keras word embeddings', 'keras word embedding', 'word embedding in python']",en,False,UCh9nVJoWXmFb7sLApWGcLPQ,codebasics
iqQgED9vV7k,Neural Network For Handwritten Digits Classification | Deep Learning Tutorial 7 (Tensorflow2.0),2020-07-18T13:30:09Z,332836,5804,453,PT36M39S,hd,"['digit recognition neural network', 'handwritten digit recognition using tensorflow', 'handwritten digit recognition', 'handwritten digit recognition using cnn', 'handwritten digits classification', 'handwritten digit recognition with tensorflow', 'mnist neural network', 'mnist digit recognition', 'handwritten recognition using neural network', 'mnist digit recognition python', 'digit recognition using machine learning', 'convolutional neural network mnist', 'handwritten digits classification using cnn']",en,False,UCh9nVJoWXmFb7sLApWGcLPQ,codebasics
y42CzmzMk68,Your First Data Analytics Project,2022-08-30T13:30:26Z,124679,8333,37,PT57S,hd,"['yt:cc=on', 'data analytics project ideas', 'data analytics projects for final year students', 'data analytics project from scratch', 'data analytics projects for beginners', 'data analytics project step by step', 'data science project ideas for final year', 'data science project ideas']",en,False,UCh9nVJoWXmFb7sLApWGcLPQ,codebasics
yWdmGxoBfFg,About Data Analyst Bootcamp 2.0..,2023-11-28T13:57:08Z,21330,553,167,PT12M15S,hd,"['yt:cc=on', 'data analyst bootcamp', 'data analyst bootcamp upgrade', 'bootcamp upgrade', 'portfolio website', 'new features', 'course upgrade', 'data analyst 2.0', 'job assistance', 'smart job assistance']",en,False,UCh9nVJoWXmFb7sLApWGcLPQ,codebasics
7HPwo4wnJeA,Image classification using CNN (CIFAR10 dataset) | Deep Learning Tutorial 24 (Tensorflow & Python),2020-10-24T13:30:10Z,405808,6598,302,PT28M12S,hd,"['cnn image classification python', 'tensorflow cnn image classification tutorial', 'image classification', 'image classification using deep learning', 'cnn image classification', 'image classification using tensorflow', 'cnn model for image classification', 'image classification using cnn', 'image classification in python', 'image classification using neural network', 'image classification using cnn in python', 'deep learning image classification', 'image classification using cnn tensorflow', 'cifar 10']",en,False,UCh9nVJoWXmFb7sLApWGcLPQ,codebasics
mTVf7BN7S8w,"Data augmentation to address overfitting | Deep Learning Tutorial 26 (Tensorflow, Keras & Python)",2020-11-01T13:30:10Z,110844,2155,129,PT31M33S,hd,"['yt:cc=on', 'data augmentation in keras', 'data augmentation in machine learning', 'data augmentation tensorflow', 'data augmentation for images', 'data augmentation python', 'data augmentation in cnn', 'data augmentation in deep learning', 'data augmentation', 'image augmentation for deep learning', 'data augmentation using keras', 'overfitting in deep learning', 'overfitting in keras', 'keras data augmentation', 'tensorflow data augmentation', 'deep learning data augmentation', 'data augmentation tutorial']",en,False,UCh9nVJoWXmFb7sLApWGcLPQ,codebasics
Q2NtCcqmIww,Word2Vec Part 2 | Implement word2vec in gensim |  | Deep Learning Tutorial 42 with Python,2021-05-21T13:30:29Z,74606,1566,102,PT18M40S,hd,"['yt:cc=on', 'gensim word2vec', 'word2vec', 'word2vec gensim', 'word2vec explained', 'word2vec python', 'word to vec', 'nlp word2vec', 'word2vec tutorial', 'gensim doc2vec', 'python word2vec', 'word2vec with gensim', 'word2vec with gensim python', 'word2vec with gensim keras', 'word2vec with gensim deep learning', 'word2vec with nlp', 'word2vec using nlp', 'word2vec using gensim', 'word2vec deep learning', 'gensim word2vec tutorial', 'gensim word2vec example', 'gensim word2vec tutorial python', 'gensim library in python']",en,False,UCh9nVJoWXmFb7sLApWGcLPQ,codebasics
VFEOskzhhbc,"Tensorflow Input Pipeline | tf Dataset | Deep Learning Tutorial 44 (Tensorflow, Keras & Python)",2021-06-10T14:30:09Z,82000,1757,77,PT33M19S,hd,"['tf data pipeline', 'tf data shuffle', 'tf data api', 'tf.data.dataset tutorial', 'tensorflow input pipeline', 'tf input pipeline', 'tensorflow data shuffle', 'tensorflow data api', 'input pipeline tensorflow', 'input pipeline', 'tensorflow pipeline', 'tensorflow pipeline example', 'tensorflow dataset', 'tensorflow input pipeline tutorial', 'tensorflow data pipeline', 'tensorflow input pipeline performance', 'Input data pipeline', 'tf.data pipeline', 'tensorflow datasets', 'loading data tensorflow']",en,False,UCh9nVJoWXmFb7sLApWGcLPQ,codebasics
9SdLOcGnebU,"Tensorboard Introduction | Deep Learning Tutorial 16 (Tensorflow2.0, Keras & Python)",2020-08-29T14:00:11Z,71699,1589,63,PT14M56S,hd,"['tensorboard tutorial', 'tensorboard', 'tensorboard graph deep learning tutorial', 'kera tutorial', 'tensorboard jupyter notebook', 'pytorch tensorboard', 'tensorboard tutorial pytorch', 'tensorboard tutorial tensorflow', 'tensorboard tutorial keras', 'tensorboard tutorial for beginners', 'tensorboard keras', 'tensorboard deep learning', 'tensorflow tensorboard tutorial', 'tensorboard python tutorial', 'tensorflow tensorboard example', 'tensorboard tensorflow tutorial', 'using tensorboard with keras']",en,False,UCh9nVJoWXmFb7sLApWGcLPQ,codebasics
ez2N-hcwvcQ,4. Strings [Python 3 Programming Tutorials],2019-05-08T04:51:05Z,175776,1844,70,PT7M12S,hd,"['python strings', 'python strings tutorial', 'python 3 strings', 'python programming strings', 'python string tutorial', 'python string methods', 'string in python', 'create string in python', 'string function in python', 'how to use strings in python', 'strings in python', 'string operations in python', 'string methods in python', 'python string examples', 'string interpolation', 'string formating', 'substrings in python', 'python substring', 'string slicing in python', 'how to use a string in python']",en,False,UCh9nVJoWXmFb7sLApWGcLPQ,codebasics
dGtDTjYs3xc,Deep learning project end to end | Potato Disease Classification Using CNN - 1 : Problem Statement,2021-08-22T14:02:27Z,245098,4017,137,PT9M35S,hd,"['yt:cc=on', 'machine learning projects for final year', 'machine learning projects end to end', 'machine learning projects from scratch', 'deep learning projects for beginners', 'deep learning projects for final year', 'deep learning projects with source code', 'deep learning projects end to end', 'deep learning projects', 'deep learning live project', 'cnn projects', 'cnn projects using deep learning', 'cnn projects on deep learning', 'cnn deep learning projects in python']",en,False,UCh9nVJoWXmFb7sLApWGcLPQ,codebasics
ATK6fm3cYfI,Text Representation Using TF-IDF: NLP Tutorial For Beginners - S2 E6,2022-08-17T14:05:36Z,35549,741,19,PT36M18S,hd,"['yt:cc=on', 'natural language processing python', 'natural language processing tutorial', 'natural language processing full course', 'nlp tutorial', 'nlp python', 'spacy tutorial nlp', 'nlp tf-idf', 'what is tf-idf', 'tf-idf intuition', 'tfidf', 'tf idf nlp', 'term frequency', 'tf idf', 'calculate tf-idf in nlp', 'tf idf problem', 'tf-idf explained', 'tf idf explained', 'tf idf example', 'tf idf model', 'tf idf model nlp', 'what is tf-idf and bag of words in nlp', 'text representation using tf-idf']",en,False,UCh9nVJoWXmFb7sLApWGcLPQ,codebasics
0cQj7q8EWxY,7. Debug Python code using PyCharm [Python 3 Programming Tutorials],2019-05-08T04:51:05Z,141899,1461,47,PT9M39S,hd,"['debug python program in pycharm', 'pycharm debugging', 'pycharm debug', 'how to debug in pycharm', 'pycharm debugger tutorial', 'pycharm debugger', 'debugging in pycharm python', 'debugging in pycharm', 'how to use pycharm debugger', 'debugging', 'pycharm', 'python', 'how to debug python program using pycharm', 'debug python using pycharm', 'debug python code in pycharm', 'debug python program', 'debug python code', 'debug in pycharm', 'django debug pychram', 'django debug configuration pycharm']",en,False,UCh9nVJoWXmFb7sLApWGcLPQ,codebasics
fz_BCnhEQYQ,10. Functions [Python 3 Programming Tutorials],2019-05-08T04:51:06Z,135284,1742,55,PT16M10S,hd,"['python functions', 'functions in python', 'python function', 'def function python', 'python function arguments', 'python function parameter', 'python function tutorial', 'python define function', 'function in python', 'what is a function in python', 'how to create a function in python', 'python functions examples', 'python functions exercises', 'python functions return', 'python functions and methods', 'python functions with parameters', 'python functions tutorial', 'python functions and procedures']",en,False,UCh9nVJoWXmFb7sLApWGcLPQ,codebasics
S3EId9uatxI,NLP Pipeline: NLP Tutorial For Beginners In Python - S1 E6,2022-03-26T13:30:12Z,55488,1496,51,PT26M2S,hd,"['yt:cc=on', 'nlp pipeline', 'nlp', 'natural language processing', 'nlp pipeline steps', 'what is nlp pipeline', 'nlp pipeline python', 'nlp pipeline stages', 'nlp operations pipeline', 'deep learning nlp pipeline', 'end to end nlp pipeline', 'nlp pipeline tutorials', 'python nlp pipeline tutorials', 'python nlp pipeline', 'python nlp pipeline tutorial', 'python nlp pipeline course', 'nlp pipeline course']",en,False,UCh9nVJoWXmFb7sLApWGcLPQ,codebasics
In7jB8TUGPA,NLP Tasks: NLP Tutorial For Beginners In Python - S1 E5,2022-02-19T14:30:11Z,51948,1165,43,PT22M38S,hd,"['yt:cc=on', 'natural language processing python', 'nlp python', 'nlp tasks', 'nlp task tutorials', 'nlp tasks overview', 'types of nlp tasks', 'list of nlp tasks', 'major tasks of nlp', 'key tasks of nlp', 'tasks of nlp', 'common nlp tasks', 'natural language processing tasks', 'natural language processing tasks overview', 'nlp task', 'list of nlp task', 'nlp tasks python', 'nlp tasks tutorial', 'nlp tasks deep learning', 'nlp deep learning tasks', 'nlp deep learning tasks tutorial']",en,False,UCh9nVJoWXmFb7sLApWGcLPQ,codebasics
_lR3RjvYvF4,Tokenization in Spacy: NLP Tutorial For Beginners - S1 E8,2022-04-20T15:00:11Z,47965,1698,47,PT35M46S,hd,"['yt:cc=on', 'spacy tutorial nlp', 'word tokenization', 'sentence tokenizer spacy', 'tokenization in nlp', 'word tokenizer spacy', 'tokenization and spacy', 'spacy', 'spacy nlp', 'tokenization in spacy', 'spacy tutorial', 'how to use spacy for tokenization', 'python spacy tutorial', 'tokenization basics with nlp spacy', 'tokenization with nlp spacy', 'tokenization nlp spacy', 'tokenization with nlp', 'tokenization with spacy', 'nlp tokenization tutorial', 'tokenization spacy tutorial', 'spacy tokenization tutorial']",en,False,UCh9nVJoWXmFb7sLApWGcLPQ,codebasics
aDpnaxPAmtU,"Applications of computer vision | Deep Learning Tutorial 22 (Tensorflow2.0, Keras & Python)",2020-10-08T12:30:10Z,75382,2406,62,PT9M44S,hd,"['computer vision applications', 'computer vision algorithms and applications', 'deep learning and computer vision', 'deep learning computer vision tutorial', 'computer vision', 'computer vision tutorial', 'computer vision deep learning', 'computer vision projects', 'what is computer vision', 'computer vision python', 'computer vision in artificial intelligence', 'how computer vision works', 'computer vision keras', 'computer vision tensorflow', 'deep learning computer vision applications']",en,False,UCh9nVJoWXmFb7sLApWGcLPQ,codebasics
ppmIOUIz4uI,Bubble Sort - Data Structures & Algorithms Tutorial Python #14,2020-09-18T13:00:20Z,69883,1590,83,PT15M9S,hd,"['bubble sort in python', 'bubble sort algorithm python', 'python bubble sort', 'bubble sort algorithm in python', 'bubble sort python', 'sorting in python', 'sorting algorithms in python', 'sorting algorithms python', 'bubble sorting in python', 'python bubble sort algorithm', 'python bubble sort algorithm with code', 'python bubble sort algorithm implement', 'python sorting algorithm', 'sorting techniques in python', 'python bubble sort example', 'bubble sort python code', 'python program bubble sort']",en,False,UCh9nVJoWXmFb7sLApWGcLPQ,codebasics
Wr1JjhTt1Xg,FastAPI Tutorial | FastAPI vs Flask,2021-08-18T12:30:11Z,66153,1527,61,PT16M13S,hd,"['yt:cc=on', 'fastapi python tutorial', 'fastapi vs flask', 'fastapi explained', 'fastapi example', 'fastapi example python', 'fastapi', 'fastapi tutorial', 'fastapi introduction', 'Flask vs FastAPI']",en,False,UCh9nVJoWXmFb7sLApWGcLPQ,codebasics
ltOAU5qu9sc,A Killer Update In Power BI ðŸ”¥,2022-05-31T14:00:19Z,112734,4472,27,PT48S,hd,"['yt:cc=on', 'power bi', 'power bi tutorial for beginners', 'what is power bi', 'power bi tutorial', 'power bi dashboard', 'microsoft power bi', 'power bi update', 'power bi desktop', 'power bi for beginners', 'power bi developer', 'power bi full course', 'powerbi', 'power bi course', 'microsoft power bi update', 'microsoft power bi overview']",en,False,UCh9nVJoWXmFb7sLApWGcLPQ,codebasics
JnlM4yLFNuo,Handling imbalanced dataset in machine learning | Deep Learning Tutorial 21 (Tensorflow2.0 & Python),2020-09-24T13:00:04Z,151270,3323,203,PT38M26S,hd,"['imbalanced dataset machine learning', 'handling imbalanced datasets in deep learning', 'handling imbalanced datasets in machine learning', 'smote technique in machine learning', 'imblearn smote example', 'imblearn oversampling', 'imblearn python example deep learning tutorial', 'imbalanced dataset', 'imbalanced data machine learning', 'how to handle imbalanced dataset', 'class imbalance machine learning', 'smote', 'extremely imbalanced dataset', 'binary classification imbalanced dataset']",en,False,UCh9nVJoWXmFb7sLApWGcLPQ,codebasics
j0IYCyBdzfA,Graph Introduction - Data Structures & Algorithms Tutorials In Python #12,2020-08-22T14:00:09Z,151968,2761,175,PT32M27S,hd,"['graph data structure python', 'graph data structure tutorial', 'graph data structure', 'graph data structure in python', 'graph in python', 'graphs in python', 'graph python', 'python graph', 'python graphs', 'graphs python', 'graph in data structure', 'graphs data structures', 'graph theory python', 'graph algorithms in data structures', 'data structures graphs', 'graph in dsa', 'graph data structures in python', 'python graph in data structures', 'python graph tutorial', 'graph tutorial in python']",en,False,UCh9nVJoWXmFb7sLApWGcLPQ,codebasics
t0UTQ1eOH_g,5. Lists [Python 3 Programming Tutorials],2019-05-08T04:51:06Z,167478,2023,62,PT10M24S,hd,"['list in python', 'python list', 'python lists tutorial', 'python list append', 'python array tutorial', 'lists in python', 'explore list in python', 'list python', 'remove items from list', 'add items to list', 'python lists for beginners', 'python list tutorial', 'python list programs', 'python programs on lists', 'list collection in python', 'python list collection', 'python lists and functions', 'python programs on list', 'collection in python', 'python list methods', 'python list methods playlist']",en,False,UCh9nVJoWXmFb7sLApWGcLPQ,codebasics
YmDaqXMIoeY,"GPU bench-marking with image classification | Deep Learning Tutorial 17 (Tensorflow2.0, Python)",2020-08-31T12:30:25Z,59168,1395,87,PT23M58S,hd,"['deep learning gpu benchmarks', 'deep learning gpu vs cpu', 'deep learning gpu training system', 'cpu vs gpu deep learning', 'deep learning gpu', 'deep learning gpu performance test', 'gpu performance test', 'gpu performance deep learning', 'nvidia gpu for deep learning', 'deep learning gpu requirements', 'deep learning gpu benchmarks 2022', 'gpu benchmarks for deep learning', 'gpu', 'nvidia', 'deep learning', 'deep learning uses gpus', 'tensorflow benchmark', 'rtx cards for deep learning', 'pytorch benchmark']",en,False,UCh9nVJoWXmFb7sLApWGcLPQ,codebasics
uldlsT98Bbs,Deep learning project end to end | Potato Disease Classification - 5 : Website (In React JS),2021-08-26T12:30:12Z,50871,580,130,PT20M31S,hd,"['deploy deep learning project model', 'deploy deep learning project using react js', 'deploying deep learning project using react js', 'deep learning project website deployment', 'how to deploy deep learning project on website', 'deep learning project deployment using react js website', 'deep learning project web app', 'build a deep learning project web application', 'build a deep learning project web app', 'deep learning project with deployment', 'image classification deep learning project']",en,False,UCh9nVJoWXmFb7sLApWGcLPQ,codebasics
9QiZ0-HZG_A,Power BI Project For Beginners | Sales Insights Data Analysis Project - 2 - Data Discovery,2020-06-24T13:00:11Z,235329,2835,98,PT10M18S,hd,"['data analysis project using power bi', 'data analyst project', 'power bi project', 'data analysis projects for beginners', 'data analyst project example', 'data analytics project examples', 'power bi project tutorial', 'power bi projects', 'power bi data discovery', 'power bi project data discovery', 'data analytics data discovery', 'data discovery data analytics', 'data analytics project', 'power bi project step by step', 'power bi end to end project', 'power bi beginners tutorial']",en,False,UCh9nVJoWXmFb7sLApWGcLPQ,codebasics
bns5ELvbzVk,"Deep learning project end to end | Potato Disease Classification - 2 :Data collection, preprocessing",2021-08-23T13:00:10Z,181884,3259,158,PT32M3S,hd,"['yt:cc=on', 'machine learning projects with source code', 'machine learning projects end to end', 'machine learning projects from scratch', 'deep learning projects in python', 'deep learning projects for beginners', 'deep learning projects end to end', 'deep learning project data collection', 'deep learning project', 'deep learning projects preprocessing', 'data preprocessing in deep learning projects', 'data collection in deep learning projects']",en,False,UCh9nVJoWXmFb7sLApWGcLPQ,codebasics
MSBY28IJ47U,"Customer churn prediction using ANN | Deep Learning Tutorial 18 (Tensorflow2.0, Keras & Python)",2020-09-07T15:30:10Z,147790,2890,187,PT40M41S,hd,"['customer churn prediction', 'customer churn prediction python', 'churn prediction ann', 'churn prediction', 'customer churn prediction analysis', 'customer churn prediction in python', 'churn prediction python', 'customer churn deep learning', 'customer churn machine learning', 'customer churn prediction using machine learning', 'churn prediction machine learning', 'customer churn prediction ann', 'churn prediction model', 'churn prediction project', 'develop churn prediction model using python']",en,False,UCh9nVJoWXmFb7sLApWGcLPQ,codebasics
7Mp82bRhvW0,Three excellent websites to practice SQL interview questions ðŸ”¥,2022-09-17T15:00:04Z,23762,1299,8,PT43S,hd,"['sql', 'mysql', 'thisisqld', 'sqlserver', 'phpmysql', 'sqlife', 'python', 'java', 'javascript', 'programming', 'html', 'database', 'css', 'php', 'coding', 'developer', 'programmer', 'software', 'datascience', 'webdeveloper', 'machinelearning', 'code', 'audiomobil', 'sqldeveloper', 'spl', 'computerscience', 'sq', 'oracle', 'webdevelopment', 'data', 'dataanalytics']",en,False,UCh9nVJoWXmFb7sLApWGcLPQ,codebasics
_3ahmI5vpKY,Text Representation Basics: NLP Tutorial For Beginners - Season 2 Episode 1,2022-07-01T14:38:42Z,21312,668,20,PT12M26S,hd,"['yt:cc=on', 'natural language processing python', 'natural language processing tutorial', 'natural language processing full course', 'nlp tutorial', 'nlp python', 'spacy tutorial nlp', 'text representation nlp', 'nlp feature engineering', 'natural language processing', 'text representation', 'nlp', 'nlp text representation', 'nlp tutorial for beginners', 'text representation nlp tutorial', 'text representation nlp python', 'python text representation', 'python nlp text representation', 'text representation spacy']",en,False,UCh9nVJoWXmFb7sLApWGcLPQ,codebasics
5iSZ7mh_RAk,Quick Sort - Data Structures & Algorithms Tutorial Python #15,2020-09-20T16:31:31Z,87624,1458,107,PT31M17S,hd,"['quick sort python', 'quick sort algorithm python', 'quick sort algorithm', 'quick sort in python', 'python quick sort', 'quicksort python', 'quicksort in python', 'quicksort algorithm python', 'quicksort data structure', 'python quicksort', 'python sorting algorithms', 'quicksort in python explained', 'python quicksort with code', 'python quicksort program', 'python quick sort algorithm', 'python quick sort time complexity', 'python quicksort concept', 'python quicksort complexity', 'python code for quick sort']",en,False,UCh9nVJoWXmFb7sLApWGcLPQ,codebasics
hOCDJyZ6quA,"Text Classification Using BERT & Tensorflow | Deep Learning Tutorial 47 (Tensorflow, Keras & Python)",2021-08-28T20:24:11Z,130016,2156,127,PT29M14S,hd,"['yt:cc=on', 'BERT Model', 'bert model nlp python', 'BERT text classification', 'tensorflow bert', 'tensorflow bert tutorial', 'text classification tensorflow', 'bert deep learning', 'bert model nlp', 'bert text classification tensorflow', 'text classification bert', 'text classification using tensorflow', 'text classification using bert', 'bert text classification', 'text classification using bert model', 'multi class text classification', 'text classification', 'bert', 'multi class text classification using bert']",en,False,UCh9nVJoWXmFb7sLApWGcLPQ,codebasics
IJCcHDLv7ss,GPT-4 Demo | GPT3 vs GPT4,2023-03-15T11:00:12Z,130796,1529,146,PT10M22S,hd,"['yt:cc=on', 'gpt-4', 'gpt4', 'gpt4 demo', 'gpt4 news', 'gpt 4 openai', 'gpt3 vs gpt4', 'gpt4 vs gpt3']",en,False,UCh9nVJoWXmFb7sLApWGcLPQ,codebasics
tT4V7zguCnc,How Data Analysts Build Dashboard in Real Time? | Revenue Insights | Hospitality Domain,2023-02-04T13:30:06Z,225431,6187,201,PT1H37M25S,hd,['yt:cc=on'],en,False,UCh9nVJoWXmFb7sLApWGcLPQ,codebasics
eaFaD_IBYW4,Data Science Roadmap 2023 | Learn Data Science Skills in 6 Months,2023-01-12T13:30:12Z,516720,23981,849,PT48M29S,hd,"['data science', 'data science roadmap', 'data science course', 'data science for beginners', 'how to learn data science', 'data science roadmap 2023', 'data science roadmap for beginners', 'data scientist', 'learn data science', 'data science tutorial', 'data science roadmap 2022', 'data science career path', 'learn data science step by step', 'data science career', 'what is data science', 'learn data science roadmap', 'data science learning path', 'complete data science roadmap', 'data scientist roadmap']",en,False,UCh9nVJoWXmFb7sLApWGcLPQ,codebasics
