video_id,title,published,view_count,like_count,comment_count,duration,definition,tags,default_audio_language,madeforkid,channel_id,channelTitle
YJKEqaaSGDs,Python Tutorial - 3. Numbers,2015-12-20T02:54:56Z,32419,321,31,PT10M,hd,"['python', 'python tutorial', 'python for beginners', 'learn python', 'learn python programming', 'how to', 'tutorial', 'coding tutorial', 'python programming', 'learn coding', 'python beginner tutorial', 'python programming tutorial', 'python tutorial for beginners', 'python coding tutorials', 'python programming for beginners', 'python programming for kids', 'tutorial python', 'tutorial python 3.5', 'tutorial python 3', 'numbers in python', 'python numbers', 'python numbers tutorial']",,False,UCh9nVJoWXmFb7sLApWGcLPQ,codebasics
vL4yC-wyKu8,Team Codebasics UNITED ðŸ”¥ðŸŽ‡,2023-02-08T08:48:46Z,22905,1378,27,PT49S,hd,,en,False,UCh9nVJoWXmFb7sLApWGcLPQ,codebasics
Yt3PQU_qEtc,Data Engineering Interview Tips By Airbnb Data Engineer | Part 2,2022-01-15T14:30:08Z,26780,718,29,PT18M57S,hd,"['data engineering facebook', 'data engineering netflix', 'data engineering airbnb', 'data engineering career tips', 'data engineering interview', 'data engineering job interview', 'data engineer interview questions', 'data engineer interview', 'data engineer at netflix', 'data engineer airbnb', ""airbnb's data engineering strategy"", ""airbnb's data engineer"", 'data structure interview questions', 'data structure interview questions for experienced', 'day in the life of a software engineer', 'airbnb interview']",en,False,UCh9nVJoWXmFb7sLApWGcLPQ,codebasics
NimKbtap1lU,Data Science Roadmap! ðŸ›£âœ… #codebasics #shorts #dataanalysis #data,2023-09-12T12:30:11Z,7748,730,46,PT45S,hd,"['codebasics', 'roadmap for data science', 'data science roadmap', 'how to become a data scientist']",en,False,UCh9nVJoWXmFb7sLApWGcLPQ,codebasics
95OyAjIZAbs,Distributed Training On NVIDIA DGX Station A100 | Deep Learning Tutorial 43 (Tensorflow & Python),2021-06-01T14:30:09Z,28906,586,50,PT14M16S,hd,"['yt:cc=on', 'deep learning multi gpu', 'deep learning gpu setup', 'tensorflow distributed training', 'tensorflow mirrored stratergy', 'distributed training', 'distributed training deep learning', 'deep learning on multi gpu', 'distributed training on dgx', 'distributed training on dgx station', 'distributed training on nvidia dgx station', 'tensorflow distributed training nvidia dgx station', 'distributed training nvidia dgx station', 'dgx a100', 'nvidia dgx a100', 'nvidia dgx station a100 deep learning']",en,False,UCh9nVJoWXmFb7sLApWGcLPQ,codebasics
6-UByNVIHwU,Something MORE IMPORTANT than tech skills! ðŸ¤”ðŸ¤¯ #dataanalysis #datascience #data #shorts,2023-08-31T12:30:03Z,7994,647,4,PT47S,hd,"['data analusis', 'data science', 'data', 'soft skills', 'technical skills', 'data analyst', 'data analysis', 'data analytics']",en,False,UCh9nVJoWXmFb7sLApWGcLPQ,codebasics
f_csX16Y5e8,Code Monkey Mindset,2022-02-09T14:00:30Z,16741,840,19,PT59S,hd,"['code monkey', 'yt:cc=on', 'software engineering', 'software development', 'Learn programming logic', 'new programmers', 'fresher programmer', 'learn programming', 'learn to code python', 'learn to code for free', 'learn to code fast', 'learn to code python for beginners', 'learn programming for beginners', 'learn programming fast']",en,False,UCh9nVJoWXmFb7sLApWGcLPQ,codebasics
T4rlTsr1e7g,Codebasics Day: The Teacher Who Doesnâ€™t Want to Retire,2022-09-05T12:00:12Z,4865,403,43,PT5M3S,hd,"['yt:cc=on', 'the teacher who doesnâ€™t want to retire', 'teacher who doesnâ€™t want to retire', 'teacher who donâ€™t want to retire', 'teacher wonâ€™t want to retire', 'teachers day', 'teachers day video', 'teachers day card', 'happy teachers day', 'codebasics teachers day', 'teachers day codebasics']",en,False,UCh9nVJoWXmFb7sLApWGcLPQ,codebasics
tB2dp6OKoz8,NVIDIA GTC & A Giveaway!,2022-03-19T02:30:13Z,5862,215,45,PT6M18S,hd,"['yt:cc=on', 'nvidia gtc 2022', 'nvidia', 'gtc', 'giveaway', 'gpu', 'graphics card', 'nvidia graphics card', 'nvidia giveaway', 'tech with tim giveaway', 'nvidia gtc', 'what is gtc', 'how to enter giveaway', 'global technology conference', 'best nvidia graphics card', 'best graphics card', 'brand new graphics card', 'natural language processing', 'how to attend nvidia gtc', 'what is nvidia riva', 'nvidia riva', 'nvidia 3080 ti', '#gtc live 2022']",en,False,UCh9nVJoWXmFb7sLApWGcLPQ,codebasics
5TRr2oWeSw0,FIRST LOOK: NVIDIA DGX Station A100 Unboxing,2021-04-12T17:00:16Z,48310,845,99,PT5M19S,hd,"['yt:cc=on', 'nvidia dgx station a100', 'nvidia dgx a100', 'nvidia', 'nvidia dgx station', 'nvidia gtc 2021', 'nvidia gtc station 2021', 'gtc 2021', 'gpu', 'super computing', 'nvidia a100', 'nvidia tesla a100', 'dgx a100', 'nvidia a100 gaming', 'nvidia dgx', 'dgx station a100', 'nvidia a100 80gb', 'a100 nvidia', 'nvidia tesla a100 gaming', 'dgx station', 'nvidia a100 test', 'dgx a100 unboxing', 'gpu a100 nvidia', 'nvidia dgx station a100 unboxing']",en,False,UCh9nVJoWXmFb7sLApWGcLPQ,codebasics
ZrgVlfNduj8,News classification using Gensim word vectors: NLP Tutorial For Beginners - S2 E11,2022-10-11T14:00:12Z,13219,504,36,PT15M26S,hd,"['yt:cc=on', 'natural language processing python', 'natural language processing tutorial', 'natural language processing full course', 'nlp tutorial', 'nlp python', 'spacy tutorial nlp', 'gensim word2vec', 'word2vec', 'word2vec gensim', 'word2vec with gensim nlp', 'word2vec with nlp', 'word2vec using nlp', 'gensim word2vec tutorial', 'gensim word2vec tutorial python', 'gensim library in nlp', 'text classification using gensim', 'nlp text classification using gensim', 'text classification using nlp']",en,False,UCh9nVJoWXmFb7sLApWGcLPQ,codebasics
GkQCChXvxw0,Data Analyst Job-Ready ChecklistðŸš€ðŸš€,2023-09-07T12:30:14Z,11041,806,12,PT46S,hd,"['yt:cc=on', 'data analyst jobs', 'data analyst', 'data analyst career', 'data analyst career guid', 'data analyst checklist', 'data analyst roadmap', 'data analysis 2023', 'data analyst 2023', 'data analyst projects', 'data analyst resume', 'data analyst interview', 'data analyst interview preparation']",en,False,UCh9nVJoWXmFb7sLApWGcLPQ,codebasics
f-Zf5eWSW3k,"ChatGPT vs BARD, Which is better?",2023-05-17T13:30:12Z,14577,345,38,PT17M12S,hd,"['yt:cc=on', 'chatgpt vs bard', 'bard vs chatgpt', 'bard ai']",en,False,UCh9nVJoWXmFb7sLApWGcLPQ,codebasics
Q-x0xwHAOUQ,Free data analytics project for your resume with hospitality dataset | Challenge #1,2022-09-21T13:00:11Z,21578,607,16,PT8M17S,hd,"['yt:cc=on', 'resume projects', 'projects for data science resume', 'data analyst resume projects', 'data analyst projects for beginners', 'data analyst project examples', 'data analytics', 'data analyst', 'data analytics resume project', 'data analyst resume', 'data analytics project', 'data analyst project', 'data analyst projects']",en,False,UCh9nVJoWXmFb7sLApWGcLPQ,codebasics
pXuTupqq0xg,How can you start learning data science from your school days?,2021-03-19T14:30:13Z,5440,151,56,PT6M21S,hd,"['learn data science in school', 'data science for beginners', 'data science for non technical', 'data science for non programmers', 'how to switch career to data science', 'how to learn data science in school', 'data science for students', 'data science in study', 'data science in school time', 'how to learn data science in school time', 'data science in education', 'data science in school']",en,False,UCh9nVJoWXmFb7sLApWGcLPQ,codebasics
G3uclekof0c,Data Visualization Tip: Provide a Context,2022-07-04T14:00:08Z,8536,420,7,PT44S,hd,"['yt:cc=on', 'data visualization', 'data visualization tips', 'data visualization reports tips', 'data visualization reports', 'data visualization report', 'data visualization provide a context', 'data visualization design', 'data visualization context']",en,False,UCh9nVJoWXmFb7sLApWGcLPQ,codebasics
bswlUucUuMk,NVIDIA GTC 21 & a Giveaway !,2021-10-12T13:00:32Z,6826,273,219,PT2M36S,hd,['yt:cc=on'],en,False,UCh9nVJoWXmFb7sLApWGcLPQ,codebasics
pqSoCa2NGj4,Power BI Data Analytics Project: Personal Finance Dashboard,2021-01-30T15:30:10Z,126696,2721,191,PT1H28M18S,hd,"['yt:cc=on', 'data analystics project', 'data analytics projects for beginners', 'power bi project example', 'power bi project dashboard', 'power bi dashboard', 'power bi project', 'power bi projects for practice', 'power bi projects', 'power bi real time project', 'financial dashboard', 'finance dashboard power bi', 'interactive personal finance dashboard', 'interactive finance dashboard', 'powerbi interactive finance dashboard', 'financial dashboard powerbi', 'personal finance dashboard']",en,False,UCh9nVJoWXmFb7sLApWGcLPQ,codebasics
JLJwOP1Djdw,"Resume tips from levels.fyi founder (Ex Linkedin, Amazon Engineer) | Part 1",2021-08-28T14:00:11Z,8115,216,14,PT20M11S,hd,"['resume tips from levels.fyi founder', 'resume tips from expert', 'how to write a resume', 'resume tips', 'how to prepare a resume', 'how to write a resume for software job', 'resume', 'resume writing', 'how to make a resume', 'resume writing tips', 'how to make a good resume', 'how to write a good resume', 'how to make a cv', 'how to make a resume for first job', 'how to make resume for job', 'resume for freshers', 'how to make resume for freshers', 'how to write a resume for I.T job', 'how to create a resume']",en,False,UCh9nVJoWXmFb7sLApWGcLPQ,codebasics
5Uc_m9CRWro,Data Science & Machine Learning Project - Part 5 Training a Model | Image Classification,2020-06-15T12:30:08Z,35426,432,45,PT20M1S,hd,"['image classification machine learning project', 'machine learning models explained', 'machine learning models', 'machine learning data science', 'machine learning models for project', 'training a machine learning model', 'train and test data', 'training and testing data in machine learning', 'training in machine learning project', 'explain training and testing in machine learning', 'what is training data in machine learning', 'what is testing of data in machine learning']",en,False,UCh9nVJoWXmFb7sLApWGcLPQ,codebasics
ObmpEe-61go,Learn DevOps Skills For Free Using KodeKloud Engineer,2021-02-17T16:00:13Z,19960,567,46,PT8M49S,hd,"['learn devops step by steps', 'learn devops free', 'devops learning path for beginners', 'devops skills', 'devops skills for free', 'devops engineer skills', 'free devops engineer skills', 'kodekloud', 'devops engineer', 'devops free', 'how to learn devops step by step', 'skills for devops engineer', 'skills required for devops engineer', 'devops required skills', 'devops developer skills', 'devops skills set', 'devops engineer skills required', 'devops skills to learn', 'devops skills to learn in 2021']",en,False,UCh9nVJoWXmFb7sLApWGcLPQ,codebasics
icGPvdH4PJo,250 to 650 People During Pandemic | Hypergrowth Story of Bacancy Technology,2021-07-20T13:30:09Z,5041,101,3,PT21M55S,hd,"['hypergrowth story of tech business', 'tech business', 'tech business grow during pandemic', 'tech business during pandemic', 'business grow during pandemic', 'business during pandemic', 'software development', 'software development company', 'how to build a software development company', 'how to start software development company', 'how to start a software company', 'bacancy technology', 'bacancy technology review', 'agile software development', 'top dedicated software developers']",en,False,UCh9nVJoWXmFb7sLApWGcLPQ,codebasics
K_oJLQx2ySY,How to pass a coding interview |Interview tips for software developer |Cracking the coding interview,2020-08-26T12:30:10Z,101252,3080,121,PT20M34S,hd,"['coding interview tips', 'programming interview prep', 'programming interview tips', 'programming interview preparation', 'software engineer interview preparation', 'software engineer interview tips', 'interview tips for software developer', 'Tips to crack a coding interview', 'how to crack coding interview', 'coding interview', 'coding interview preparation', 'how to pass coding interview', 'coding interview tips and tricks', 'prepare for coding interview', 'tips for coding interviews']",en,False,UCh9nVJoWXmFb7sLApWGcLPQ,codebasics
HLU4oDOinzo,What is Metaverse? Metaverse Career Opportunities,2022-02-26T14:30:13Z,35451,1037,57,PT11M17S,hd,"['codebasics', 'facebook meta', 'facebook metaverse', 'mark zuckerberg metaverse', 'meta', 'meta metaverse', 'metaverse', 'metaverse career opportunities', 'metaverse crypto', 'metaverse explained', 'metaverse meaning', 'metaverse roblox', 'the metaverse', 'what is meta', 'what is metaverse', 'what is metaverse facebook', 'what is the metaverse', 'what is metaverse technology', 'metaverse technology', 'the metaverse explained', 'facebook metaverse meaning', 'metaverse codebasics', 'metaverse business opportunities']",en,False,UCh9nVJoWXmFb7sLApWGcLPQ,codebasics
vBmYnaMz0kk,Codebasics Data Analyst Bootcamp is Now LIVE ðŸ”¥,2023-04-27T13:30:08Z,30033,697,308,PT21M44S,hd,"['yt:cc=on', 'Data anlytics bo', 'data analyst', 'job ready', 'interview preparation', 'Codebasics', 'Excel', 'SQL', 'Power BI', 'and Python', 'Real-time industry-based projects', 'Resume & Interview preparation', 'Building online credibility']",en,False,UCh9nVJoWXmFb7sLApWGcLPQ,codebasics
VCocqboGRo4,âœ…One Key Difference Between Average & Great Data Analyst! #codebasics #shorts,2023-10-23T12:30:27Z,15556,790,4,PT44S,hd,"['how to be a better data analyst', 'data analyst', 'data analyst tip', 'great data analyst', 'difference mindset']",en,False,UCh9nVJoWXmFb7sLApWGcLPQ,codebasics
GKGIYPmdXGc,NVIDIA TITAN RTX UNBOXING,2020-07-31T12:30:01Z,4826,176,49,PT3M2S,hd,"['NVIDIA GPU unboxing', 'deep learning GPU', 'codebasics nvidia gpu']",en,False,UCh9nVJoWXmFb7sLApWGcLPQ,codebasics
87PzGnEzCNc,How to earn money by coding | Make money by programming,2020-09-22T12:30:10Z,153096,5261,264,PT14M23S,hd,"['earn money coding', 'make money programming', 'how to make money coding', 'make money coding', 'make money with coding', 'make money coding from home', 'how to earn money by coding', 'how to make money from coding', 'how to make money with coding', 'how to earn by coding', 'money coding', 'coding jobs from home', 'how to earn from coding', 'make money from coding', 'how to earn money from coding', 'how to make money as a programmer', 'ways to make money coding', 'practical ways to make money coding']",en,False,UCh9nVJoWXmFb7sLApWGcLPQ,codebasics
Tjkz4Kt21wI,Debugging Tips - Conditional Breakpoint,2016-05-29T22:19:58Z,9973,172,10,PT6M8S,hd,"['conditional breakpoint', 'debugging', 'conditional breakpoint in pycharm', 'debugging tips', 'breakpoint in debugging', 'conditional breakpoint python', 'debugging breakpoints', 'debugging guide', 'how to debug for beginners', 'how to debug code', 'how to debug', 'breakpoint python', 'break point functional', 'pycharm conditional breakpoint example', 'conditional breakpoints', 'debugging conditional breakpoints', 'breakpoint debugging', 'conditional breakpoint debugging', 'break point debugging tips']",,False,UCh9nVJoWXmFb7sLApWGcLPQ,codebasics
L7a1QBJdbzg,B Com to Software Developer Transition,2023-01-10T13:30:10Z,8312,333,55,PT27M11S,hd,"['yt:cc=on', 'b com to software developer', 'b.com to software developer', 'how to change career to it industry after b com', 'change career to it industry after b com', 'how to switch career in it', 'switch career to it', 'how to switch career to coding', 'how to switch to it career', 'switch career in it after bcom', 'b com to software developer transition', 'how to switch to it career successfully', 'how to change careers', 'how to switch to it career successfully in 2023']",en,False,UCh9nVJoWXmFb7sLApWGcLPQ,codebasics
Ouq0cCtqefE,The Ultimate Data Science Job Checklist! âœ…  #codebasics #shorts #dataanalysis #data,2023-09-08T12:30:22Z,6067,470,13,PT54S,hd,"['yt:cc=on', 'data analyst jobs', 'data analyst', 'data analyst career', 'data analyst career guid', 'data analyst checklist', 'data analyst roadmap', 'data analysis 2023', 'data analyst 2023', 'data analyst projects', 'data analyst resume', 'data analyst interview', 'data analyst interview preparation']",en,False,UCh9nVJoWXmFb7sLApWGcLPQ,codebasics
XXRtOmI7-kM,My YouTube setup (hardware and software) | Youtube Setup For Coding Channel,2020-12-20T14:30:12Z,11128,299,39,PT7M6S,hd,"['yt:cc=on', 'codebasics youtube setup', 'equipment for programming youtube channel']",en,False,UCh9nVJoWXmFb7sLApWGcLPQ,codebasics
yXEZr2fg3TY,Masters in Physics to Data Scientist Career Transition Story,2021-12-21T13:30:10Z,28641,1048,95,PT24M37S,hd,"['physics to data scientist career transition', 'data science career transition', 'physics to data scientist', 'non it to data science career transition', 'non it to data science', 'data scientist career change', 'data science interview questions', 'data scientist career transition story', 'career transition data scientist', 'data scientist career transition', 'data scientist career transition interview', 'career transition in data science', 'data science career transition interview']",en,False,UCh9nVJoWXmFb7sLApWGcLPQ,codebasics
vdYYTIN96H0,Debugging Tips - Watches and Call Stack,2016-06-02T02:25:31Z,8084,124,10,PT6M26S,hd,"['call stack', 'debugging tips', 'debugging', 'debugging techniques', 'debugging python', 'call stack debugging', 'pycharm tutorial', 'debugging concepts', 'how to see call stack', 'how to set watches while debugging', 'watches in debugging', 'breakpoint', 'watches and call stack debugging', 'debugging call stack', 'call stack in debugging', 'debugging watches', 'what is watches window', 'debugging tutorial', 'debug']",,False,UCh9nVJoWXmFb7sLApWGcLPQ,codebasics
z4PkyYd7FUI,6 Ways to SPEED UP Python Program! ðŸŽðŸ’¨#codebasics #shorts #dataanalysis #data,2023-09-17T12:30:28Z,11854,1138,1,PT57S,hd,"['python tip', 'python speed up', 'quick python coding', 'faster python coding']",en,False,UCh9nVJoWXmFb7sLApWGcLPQ,codebasics
UnVyNh6P6FQ,The END of the Journey,2022-04-09T15:00:11Z,65700,3806,581,PT10M29S,hd,"['yt:cc=on', 'codebasics end of the journey', 'codebasics life story', 'dhaval patel codebasics life story', 'data science youtube channel', 'machine learning tutorials', 'data science tutorials', 'pandas tutorial', 'python tutorial']",en,False,UCh9nVJoWXmFb7sLApWGcLPQ,codebasics
IpawPa1e2o0,Do this to get a data science job abroad,2021-01-10T15:00:11Z,84062,2631,167,PT7M55S,hd,"['yt:cc=on', 'get a data science job abroad', 'how to get a data science job', 'data science jobs 2021', 'data science job', 'data science job usa', 'how to get data science job', 'apply for data science job', 'data science job search', 'how to get data science job as a fresher', 'data science jobs', 'data science jobs in canada', 'data science in canada', 'data scientist in canada', 'data science jobs in uk', 'data science canada', 'data analyst jobs in canada', 'data science in germany']",en,False,UCh9nVJoWXmFb7sLApWGcLPQ,codebasics
dQ7Okl0XY_s,Codebasics Coding Competition: ðŸ’¥ ð‚ðŽðƒð„-ð€-ð“ð‡ðŽð ðŸ’¥,2022-01-21T12:47:42Z,9130,313,18,PT1M1S,hd,"['competitive programming', 'codebasics coding competition', 'codebasics competition', 'coding competition', 'coding competitions', 'live coding competition']",en,False,UCh9nVJoWXmFb7sLApWGcLPQ,codebasics
woGM7Mgz7ZQ,3 Important things to get your resume picked,2022-09-19T13:30:22Z,6782,292,7,PT29S,hd,"['yt:cc=on', 'cv for data analyst', 'data analyst cv', 'data analyst resume', 'data analyst resume entry level', 'data analyst resume examples', 'data analyst resume for freshers', 'data analyst resume guide', 'data analyst resume no experience', 'data analyst resume review', 'data analyst resume sample', 'data analyst resume tips', 'how to write a data analyst resume', 'resume for data analyst fresher', 'resume writing tips data analyst', 'write a data analyst resume', 'data scientist resume review']",en,False,UCh9nVJoWXmFb7sLApWGcLPQ,codebasics
6ZXHNuwAnPw,Never ask this question to anyone! ðŸ¤«âŒ#codebasics #shorts #dataanalysis #data,2023-09-30T12:30:04Z,16692,865,8,PT16S,hd,"['interview tip', 'not to do in interview', 'do not ask this question']",en,False,UCh9nVJoWXmFb7sLApWGcLPQ,codebasics
pfktUn0Qblo,Share it with your friends if you found it relatable,2023-12-29T12:30:26Z,16776,427,8,PT11S,hd,,en,False,UCh9nVJoWXmFb7sLApWGcLPQ,codebasics
XH945kBzbdA,How do I transition from software testing to data science?,2021-09-25T14:00:11Z,33588,831,68,PT18M,hd,"['software testing to data science', 'software testing to data analyst', 'test engineer to data scientist career', 'tester to data scientist career transition', 'testing to data science', 'can a manual tester become data scientist', 'how to move from testing to data analyst', 'can a tester become data scientist', 'how to move from testing to big data', 'data science in test automation', 'can a software tester become a data scientist', 'transition into data science', 'how to transition into data science']",en,False,UCh9nVJoWXmFb7sLApWGcLPQ,codebasics
px0Oz0nRz4c,He cracked 10 Interviews..! ðŸ¤¯#codebasics #shorts #dataanalysis #data,2023-09-21T12:30:28Z,27279,1961,18,PT42S,hd,"['tech companies interview', 'how to crack big interviews', 'how to crack any interview', 'interview hacks', 'interview tips', 'big tech companies', 'meta', 'facebook', 'uber', 'affirm', 'microft', 'facebook interview cracked']",en,False,UCh9nVJoWXmFb7sLApWGcLPQ,codebasics
NWVindWhIX8,Data Engineering Career Tips By Airbnb Data Engineer | Part 1,2022-01-09T14:00:11Z,82972,2327,62,PT31M5S,hd,"['yt:cc=on', 'data engineering facebook', 'data engineering netflix', 'data engineering airbnb', 'data engineering career tips', 'data engineering career guidance', 'data engineering interview', 'data engineering job interview', 'data engineering job switch', 'data engineer interview questions', 'data engineer interview', 'data engineer at netflix', 'data engineer day in the life', 'what do data engineers do', 'data engineering project at facebook', 'data engineering at facebook', 'data engineer career']",en,False,UCh9nVJoWXmFb7sLApWGcLPQ,codebasics
l9DPw0ESQ1Q,âœ…Single tip to RISE ðŸ“ˆ in your DATA CAREER!ðŸ¤©#codebasics #shorts #dataanalysis #data #dataanalytics,2023-10-25T12:30:21Z,9285,532,9,PT13S,hd,"['how to rise in career', 'how to rise in data career', 'data career tips', 'api', 'kpi', 'management', 'domain knowledge']",en,False,UCh9nVJoWXmFb7sLApWGcLPQ,codebasics
YhiiJ3vWG-s,Top KPIs for Data Analyst Career! ðŸ“ˆðŸ¤©#codebasics #shorts #dataanalysis #data #dataanalytics,2023-10-16T12:30:20Z,8933,900,7,PT18S,hd,"['KPIs', 'KPI', 'what is KPI', 'best KPIs for DATA jobs', 'business knowledge', 'business understanding', 'kpis for business understanding']",en,False,UCh9nVJoWXmFb7sLApWGcLPQ,codebasics
20US5sfG-j8,Now ChatGPT can Read and Hear!!! ðŸ¤©ðŸ«¡#codebasics #shorts #dataanalysis #data,2023-09-29T12:30:01Z,17420,598,5,PT33S,hd,"['chatgpt', 'chatgpt new updates', 'chatgpt new features', 'how to use chatgpt', 'chatgpt tutorial', 'chatgpt image', 'image with chatgpt', 'chatgpt strategy']",en,False,UCh9nVJoWXmFb7sLApWGcLPQ,codebasics
E-ech-D96V4,Data Visualization Tip: Start with 0 ðŸ’¡ #codebasics #shorts #dataanalysis #data,2023-09-20T12:30:13Z,14341,1121,6,PT40S,hd,"['data analysis tip', 'data visualization tip', 'data career tip', 'career tip', 'career hack', 'visualization hack']",en,False,UCh9nVJoWXmFb7sLApWGcLPQ,codebasics
dPCO4obi158,Crack FAANG interview using this.! ðŸ›œðŸ‘¨â€ðŸ’»#codebasics #shorts #dataanalysis #data #dataanalytics,2023-10-20T12:30:32Z,10137,1160,16,PT37S,hd,"['how to crack faang interview', 'faang interview', 'faang interview preparation', 'faang interview tips', 'maang', 'maang interview', 'maang interview preparation']",en,False,UCh9nVJoWXmFb7sLApWGcLPQ,codebasics
s6lRU0nn_nw,Data Visualization Tip: Pie Chart vs Bar Chart ðŸ’¡ðŸ“Š #codebasics #shorts #dataanalysis #data,2023-10-05T12:30:33Z,7385,577,6,PT25S,hd,"['data analytics tip', 'dashboarding tip', 'types of charts', 'pie charts', 'bar charts', 'power bi']",en,False,UCh9nVJoWXmFb7sLApWGcLPQ,codebasics
P1uHDPpe_04,Build language translator with 3 lines of python code,2020-12-30T14:00:09Z,81403,1764,164,PT4M58S,hd,"['yt:cc=on', 'googletrans python module', 'python language translation', 'translation with python', 'python translate library', 'text translator using python', 'how to create text translator in python', 'python translator', 'language translate with python', 'python language translate', 'python translation', 'googletrans module', 'googletrans module python', 'how to use python for translation', 'use python for translation', 'python translate language', 'translate with python']",en,False,UCh9nVJoWXmFb7sLApWGcLPQ,codebasics
PFPt6PQNslE,Data Science Roadmap 2024 | Data Science Weekly Study Plan | Free Resources to Become Data Scientist,2023-12-30T13:30:11Z,28729,1314,112,PT29M18S,hd,"['data science roadmap', 'data science course', 'data science for beginners', 'how to learn data science', 'data science roadmap 2023', 'data science roadmap 2024', 'learn data science', 'data science tutorial', 'data science roadmap 2022', 'data science career path', 'learn data science step by step', 'data science career', 'what is data science', 'learn data science roadmap', 'data science learning path', 'complete data science roadmap', 'data scientist roadmap', 'how to become data scientist']",en,False,UCh9nVJoWXmFb7sLApWGcLPQ,codebasics
SAZPPitf_QY,7 Career Roles with Python! ðŸ #codebasics #shorts #dataanalysis #data,2023-10-07T12:30:23Z,8179,780,3,PT37S,hd,"['python career roles', 'python jobs', 'python career options', 'python', 'data analyst', 'data scientist']",en,False,UCh9nVJoWXmFb7sLApWGcLPQ,codebasics
