video_id,title,published,view_count,like_count,comment_count,duration,definition,tags,default_audio_language,madeforkid,channel_id,channelTitle
kfjH9nHve-8,This Attitude YOU NEED in Data Field! ðŸ“ˆâœ… #codebasics #shorts #dataanalysis #data,2023-09-15T12:30:24Z,53311,3224,35,PT55S,hd,"['career tip', 'problem solver', 'art of getting help', 'get help']",en,False,UCh9nVJoWXmFb7sLApWGcLPQ,codebasics
vBzygcF_Vpk,STOP being Data Analyst 1.0,2023-11-16T12:45:05Z,10429,786,22,PT30S,hd,,en,False,UCh9nVJoWXmFb7sLApWGcLPQ,codebasics
fIsXdtcn09U,"The real importance of a degree in data science, software engineering interview",2021-11-30T16:32:04Z,69582,2736,44,PT16S,hd,"['data science career', 'software engineering interview', 'data science interview', 'data science degree', 'computer science degree']",en,False,UCh9nVJoWXmFb7sLApWGcLPQ,codebasics
PD92bKBnmJA,NEVER do this mistake!,2023-12-14T12:30:11Z,6875,470,4,PT52S,hd,,en,False,UCh9nVJoWXmFb7sLApWGcLPQ,codebasics
V4AcLJ2cgmU,Parameters vs hyperparameters in machine learning,2021-01-21T15:30:10Z,39233,898,33,PT1M19S,hd,"['yt:cc=on', 'parameters vs hyperparameters machine learning', 'hyperparameter tuning', 'hyperparameters in machine learning', 'hyperparameters', 'hyperparameters machine learning', 'parameters vs hyperparameters', 'parameters and hyperparameters', 'parameters or hyperparameters', 'hyperparameters vs parameters', 'hyperparameters or parameters', 'hyperparameters and parameters', 'hyperparameter', 'parameters in machine learning', 'machine learning parameters']",en,False,UCh9nVJoWXmFb7sLApWGcLPQ,codebasics
R6u5EBWAssY,"Reality behind data science, machine learning jobs",2022-02-16T12:55:12Z,1418361,64800,461,PT53S,hd,"['data science and machine learning', 'data scientist jobs', 'data science jobs', 'data scientist day in the life', 'data scientist job description', 'yt:cc=on', 'data science', 'data scientist salary', 'data scientist', 'data analytics', 'career advice', 'career advice for young people', 'Data science for beginners', 'python data science', 'data science jobs for freshers', 'Data scientist salary in india', 'data science career', 'amazon data scientist', 'data science job', 'data scientist job']",en,False,UCh9nVJoWXmFb7sLApWGcLPQ,codebasics
PAAg9KHs0uI,Python Project For Your Resume: Grocery Store Management System,2023-11-22T12:30:21Z,7424,729,5,PT28S,hd,,en,False,UCh9nVJoWXmFb7sLApWGcLPQ,codebasics
hQvCOBv_-LE,What is STAR schema | Star vs Snowflake Schema | Fact vs Dimension Table,2023-02-16T13:30:09Z,70324,3406,103,PT6M59S,hd,,en,False,UCh9nVJoWXmFb7sLApWGcLPQ,codebasics
z-ZR_8BZ1wQ,"Pytorch vs Tensorflow vs Keras | Deep Learning Tutorial 6 (Tensorflow Tutorial, Keras & Python)",2020-07-17T12:30:57Z,178593,2687,49,PT2M17S,hd,"['kera tutorial', 'pytorch vs tensorflow', 'pytorch vs tensorflow vs keras', 'tensorflow vs keras', 'keras', 'tensorflow vs pytorch', 'keras vs tensorflow', 'pytorch', 'keras tutorial', 'keras vs tensorflow vs pytorch', 'keras vs pytorch', 'tensorflow', 'deep learnign with keras tensorflow and pytorch', 'deep learning keras', 'pytorch vs tensorflow for beginners', 'pytorch vs tensorflow performance', 'pytorch and tensorflow difference', 'tensorflow vs Keras difference', 'difference between pytorch keras tensorflow']",en,False,UCh9nVJoWXmFb7sLApWGcLPQ,codebasics
taC5pMCm70U,Image classification vs Object detection vs Image Segmentation | Deep Learning Tutorial 28,2020-11-30T13:30:04Z,85695,1861,39,PT2M32S,hd,"['yt:cc=on', 'image segmentation', 'what is image segmentation', 'what is object detection', 'object detection', 'image classification', 'image recognition', 'image recognition deep learning', 'image classification vs image segmentation', 'image segmentation vs image classification', 'image classification deep learning', 'image classification using cnn', 'image classification vs object detection', 'deep learning image classification', 'object detection vs image segmentation', 'object detection deep learning']",en,False,UCh9nVJoWXmFb7sLApWGcLPQ,codebasics
wKqt7ThgR1g,Is Python Really Needed For a Data Analyst Job?,2023-04-22T13:30:31Z,38750,1406,62,PT2M55S,hd,"['yt:cc=on', 'python for data analysis', 'python', 'data analyst', 'career in data analytics', 'career guidance']",en,False,UCh9nVJoWXmFb7sLApWGcLPQ,codebasics
fwY9Qv96DJY,Machine Learning Tutorial Python - 7: Training and Testing Data,2018-08-09T11:06:42Z,437863,6714,345,PT6M34S,hd,"['training and testing data in machine learning', 'train and test data', 'machine learning training and testing data', 'sklearn train test split', 'train test split python', 'train test split', 'train test split sklearn', 'sklearn train_test_split', 'train_test_split sklearn', 'sklearn split train test', 'sklearn test train split', 'scikit learn train test split', 'explain training and testing in machine learning', 'what is training data in machine learning', 'what is testing of data in machine learning']",en,False,UCh9nVJoWXmFb7sLApWGcLPQ,codebasics
xucm6_BQPJU,Artificial Intelligence (AI) vs Machine Learning vs Deep Learning vs Data Science,2020-06-22T13:00:10Z,83358,2101,138,PT3M45S,hd,"['artificial intelligence vs machine learning', 'ml vs ai vs deep learning', 'ai vs ml vs dl vs data science', 'ai vs machine learning vs deep learning', 'machine learning vs artificial intelligence', 'deep learning vs machine learning', 'ai vs machine learning', 'ai vs ml', 'ai vs ml vs dl', 'ai ml deep learning', 'data science vs machine learning', 'ai and machine learning', 'data science vs artificial intelligence', 'artificial intelligence vs machine learning vs deep learning', 'machine learning vs ai']",en,False,UCh9nVJoWXmFb7sLApWGcLPQ,codebasics
m684QWvVDTA,"PHD in machine learning or data science, is it worth?",2021-04-08T14:30:04Z,38857,839,72,PT2M38S,hd,"['yt:cc=on', 'phd in machine learning', 'phd in data science', 'phd data science', 'machine learning phd advice', 'data science phd advice', 'phd in machine learning is worth', 'phd in data science is worth', 'data science phd', 'ml phd advice', 'machine learning phd', 'phd machine learning', 'phd in ds', 'phd in ml', 'ml phd', 'ds phd', 'phd advice', 'phd in artificial intelligence', 'phd in ai']",en,False,UCh9nVJoWXmFb7sLApWGcLPQ,codebasics
pYVScuY-GPk,What is feature engineering | Feature Engineering Tutorial Python # 1,2020-05-25T03:30:05Z,123550,1956,67,PT5M12S,hd,"['feature engineering', 'feature engineering machine learning', 'feature engineering techiniques', 'feature engineering example', 'feature engineering tutorial python', 'feature engineering in data science', 'feature engineering techniques', 'feature engineering for machine learning', 'feature engineering data science', 'what is feature engineering', 'what is feature engineering machine learning', 'what is feature engineering data science', 'what is feature engineering deep learning']",hi,False,UCh9nVJoWXmFb7sLApWGcLPQ,codebasics
T8ryqTyVye4,Will AI Replace Data Analyst Jobs?,2023-05-20T13:30:10Z,75921,1971,177,PT6M20S,hd,"['yt:cc=on', 'ai data analyst', 'data analyst job after ai', 'will ai replace data analyst', 'can ai replace data analyst', 'will ai replace data analysis']",en,False,UCh9nVJoWXmFb7sLApWGcLPQ,codebasics
_t2GVaQasRY,Data Structures & Algorithms Tutorial in Python #1 - What are data structures?,2020-03-07T18:30:29Z,725969,12028,251,PT5M47S,hd,"['data structures and algorithms tutorial', 'data structure in python', 'data structures tutorials', 'python data structures', 'python data structures tutorial', 'data structures and algorithms in python', 'data structures in python', 'data structures python', 'data structures and algorithms python', 'data structure python', 'python data structure', 'data structure using python', 'dsa in python', 'dsa python', 'python dsa', 'data structures and algorithms playlist', 'python data structures and algorithms']",en,False,UCh9nVJoWXmFb7sLApWGcLPQ,codebasics
gmvvaobm7eQ,Machine Learning Tutorial Python -1: What is Machine Learning?,2018-06-30T21:31:22Z,984589,11067,220,PT6M51S,hd,"['machine learning tutorial', 'machine learning basics', 'machine learning tutorial for beginners', 'machine learning python', 'python machine learning tutorial', 'machine learning tutorial python', 'machine learning with python', 'ml tutorial', 'machine learning using python', 'machine learning tutorials', 'machine learning python tutorial', 'ml for beginners', 'ml tutorial for beginners', 'machine learning basics for beginners', 'machine learning playlist', 'python machine learning']",en,False,UCh9nVJoWXmFb7sLApWGcLPQ,codebasics
ag3DLKsl2vk,"What is YOLO algorithm? | Deep Learning Tutorial 31 (Tensorflow, Keras & Python)",2020-12-25T13:30:09Z,504700,10948,248,PT16M5S,hd,"['yolo algorithm for object detection', 'yolo algorithm explained', 'yolo computer vision', 'yolo algorithm', 'yolo algorithm deep learning', 'yolo algorithm python', 'yolo deep learning python', 'yolo deep learning', 'yolo object detection', 'what is yolo', 'yolo algorithm implementation', 'yolo tutorial', 'yolo object detection tutorial', 'yolo custom object detection', 'object detection deep learning', 'yolo', 'yolo object detection python', 'yolo python', 'how yolo works', 'yolo object detection opencv python']",en,False,UCh9nVJoWXmFb7sLApWGcLPQ,codebasics
xtTX69JZ92w,"Log normal distribution | Math, Statistics for data science, machine learning",2021-05-14T14:00:16Z,82319,1848,81,PT6M44S,hd,"['yt:cc=on', 'What is log normal distribution', 'log normal distribution explained', 'log normal distribution example', 'log normal distribution', 'lognormal distribution', 'log normal distribution data science', 'log-normal distribution', 'lognormal', 'logarithmic distribution', 'log normal distribution calculator', 'log normal distribution excel', 'log normal distribution python', 'shifted lognormal distribution', 'moments of log-normal', 'how to derive the mean of log-normal distribution']",en,False,UCh9nVJoWXmFb7sLApWGcLPQ,codebasics
VC-EliTgMEM,"Install tensorflow 2.0 | Deep Learning Tutorial 5 (Tensorflow Tutorial, Keras & Python)",2020-07-16T12:30:03Z,211840,1836,160,PT2M37S,hd,"['install tensorflow windows', 'install tensorflow', 'install tensorflow windows 10', 'how to install tensorflow', 'how to install tensorflow in jupyter notebook', 'how to install tensorflow on windows 10', 'how to install tensorflow in anaconda', 'install tensorflow in jupyter notebook', 'install tensorflow in anaconda', 'tensorflow installation windows 10', 'tensorflow install', 'how to install tensorflow in python 3.10', 'install tensorflow in python 3.10', 'install tensorflow in pycharm']",en,False,UCh9nVJoWXmFb7sLApWGcLPQ,codebasics
h4hOPGo4UVU,Python Pandas Tutorial 9. Merge Dataframes,2017-05-27T20:04:01Z,226856,3747,199,PT7M41S,hd,"['pandas merge', 'merge tutorial pandas', 'pandas merge data frames', 'merging dataframes in pandas', 'python merge', 'python pandas marge', 'merge pandas', 'merge pandas python', 'merge python', 'merge in pandas', 'how to merge diffrent dataframe', 'how to murge two data frame in python', 'join two dataframes pandas', 'how to join two pandas dataframes', 'joining and merging dataframes', 'how to combine pandas dataframes', 'how to add two dataframes', 'pandas join', 'pandas append', 'pandas merge tutorial']",en,False,UCh9nVJoWXmFb7sLApWGcLPQ,codebasics
Lu5LrKh1Zno,Python Tutorial - 27. Multiprocessing Introduction,2016-09-06T11:41:35Z,152964,1779,102,PT8M17S,hd,"['multiprocessing in python', 'multiprocessing python', 'python multiprocessing tutorial', 'multiprocessing tutorial', 'multiprocessing module python', 'python multiprocessing', 'process python', 'multiprocessing module', 'multiprocessing', 'multiprocessing in python 3', 'multiprocessing in python corey', 'multiprocessing processes', 'multiprocessing pool python', 'multiprocessing pool example python', 'multiprocessing process example', 'python multiprocessing corey schafer', 'multithreading in python example']",,False,UCh9nVJoWXmFb7sLApWGcLPQ,codebasics
KzQQCtgzQbw,"What is logarithm? | Math, Statistics for data science, machine learning",2021-04-18T15:30:13Z,88195,2531,186,PT7M52S,hd,"['yt:cc=on', 'what is logarithm used for', 'what is logarithm in english', 'logarithm in machine learning', 'math for data science', 'statistics for machine learning and data science', 'logs in data science', 'logarithm in data analysis', 'log for data science', 'logarithm in data science', 'logarithms in data science', 'logarithms for machine learning', 'logarithms', 'logarithms tutorial', 'logarithms explained', 'logarithmic functions', 'what is a logarithm', 'logarithm']",en,False,UCh9nVJoWXmFb7sLApWGcLPQ,codebasics
B01qMFMAgUQ,Machine Learning Tutorial Python - 20: Bias vs Variance In Machine Learning,2021-10-19T13:00:10Z,60397,1773,64,PT10M50S,hd,"['bias vs variance tradeoff', 'bias vs variance machine learning', 'bias vs variance explained', 'bias and variability', 'variance bias tradeoff', 'variance bias overfitting', 'bias vs variance', 'bias vs variance in machine learning', 'bias variance tradeoff', 'bias variance tradeoff in machine learning', 'bias-variance tradeoff python', 'bias-variance overfitting underfitting', 'bias and variance in machine learning', 'the bias in machine learning', 'variance in machine learning', 'bias-variance trade-off']",en,False,UCh9nVJoWXmFb7sLApWGcLPQ,codebasics
KOmGPNS-YM8,Top 8 Python Libraries You Must Know In 2023 For Data Science | Python Modules for Data Science,2022-12-22T14:00:11Z,45219,1500,45,PT5M57S,hd,"['yt:cc=on', 'python libraries for data science', 'python libraries', 'python libraries for machine learning', 'python libraries explained', 'top python libraries', 'essential python libraries for data science', 'python libraries to learn', 'popular python libraries', 'python libraries for beginners', 'python modules', 'top python modules', 'data science libraries in python', 'data visualization python library', 'python libraries for data modeling', 'must learn python libraries for data science']",en,False,UCh9nVJoWXmFb7sLApWGcLPQ,codebasics
RCM-lVAfXFg,11. Dictionaries and Tuples [Python 3 Programming Tutorials],2019-05-08T04:51:05Z,109314,1237,74,PT8M46S,hd,"['python dictionary tutorial', 'python dictionary functions', 'dictionary python 3', 'python tuples tutorial', 'tuples in python', 'python dictionaries', 'dictionaries in python', 'using dictionaries in python', 'what is dictionaries in python', 'dictionary python functions', 'dictionary python tutorial', 'python dictionary basics', 'tuple in python 3', 'tuples python', 'learn tuples in python', 'tuples python tutorial', 'tuples tutorial python', 'tuple examples in python', 'what is tuple in python']",en,False,UCh9nVJoWXmFb7sLApWGcLPQ,codebasics
BUOy4RUUepg,Python Pandas Tutorial 12. Stack Unstack,2017-07-02T17:10:33Z,87914,1594,61,PT5M53S,hd,"['pandas stack', 'pandas stack tutorial', 'pandas reshape', 'pandas reshape dataframe', 'python stack', 'pandas unstack', 'Python unstack', 'unstack', 'python pandas stack', 'python pandas unstack', 'unstack python pandas', 'stack python pandas', 'unstack data', 'stack in pandas', 'stack unstack in python', 'stack unstack pandas', 'pandas stack unstack tutorial', 'stack unstack python', 'python stack columns', 'stack function in pandas', 'pandas stack method', 'pandas stack dataframes', 'pandas stack unstack']",en,False,UCh9nVJoWXmFb7sLApWGcLPQ,codebasics
Vig1IeU2RYk,6. Install PyCharm on Windows [Python 3 Programming Tutorials],2019-05-08T04:51:05Z,133106,1186,36,PT6M33S,hd,"['install pycharm', 'how to install pycharm', 'install pycharm on windows', 'how to install pycharm on windows', 'install pycharm on windows 10', 'install pycharm ide on windows', 'how to install pycharm on windows 10', 'pycharminstallation', 'pycharm installation tutorial', 'pycharm installation', 'how to download pycharm in windows 10', 'pycharm installation windows 10', 'how to download pycharm', 'installing pycharm on windows 10', 'download pycharm for windows 10', 'installing pycharm', 'pycharm setup']",en,False,UCh9nVJoWXmFb7sLApWGcLPQ,codebasics
6XWeeEg6d3s,16. Class and Objects [Python 3 Programming Tutorials],2019-05-08T04:51:05Z,92586,1425,57,PT9M50S,hd,"['class in python', 'python classes', 'python classes and objects tutorial', 'classes and objects in python', 'what is class in python', 'python classes explained', 'python objects', 'python 3 object oriented programming', 'classes and objects python tutorial', 'classes and objects python example', 'classes and objects in python 3', 'what are classes and objects python', 'classes and objects python 3', 'classes and objects in python youtube', 'classes python', 'python classes beginners', 'classes python 3']",en,False,UCh9nVJoWXmFb7sLApWGcLPQ,codebasics
sZGuyTLjsco,"Converting words to numbers, Word Embeddings | Deep Learning Tutorial 39 (Tensorflow & Python)",2021-03-13T14:30:14Z,69182,1554,63,PT11M32S,hd,"['yt:cc=on', 'word embeddings', 'word embeddings explained', 'deep learning tutorial', 'converting words to numbers', 'word embedding', 'word embeddings deep learning', 'word embeddings machine learning', 'word embedding nlp', 'tensorflow word embedding', 'word embedding with nlp', 'nlp for word embedding', 'word embedding using tensorflow', 'word embedding keras', 'what is word embedding', 'tensorflow word embedding tutorial', 'deep learning word embedding tutorial', 'word embedding nlp tutorial']",en,False,UCh9nVJoWXmFb7sLApWGcLPQ,codebasics
JL_grPUnXzY,What is Data Science? | Free Data Science Course | Data Science for Beginners | codebasics,2019-12-10T03:47:20Z,480576,6537,351,PT6M47S,hd,"['codebasics', 'data science for beginners', 'data science tutorial', 'data science full course', 'python for data science', 'data science course', 'what is data science for beginners', 'data science with python', 'data science tutorial for beginners', 'learn data science', 'how to learn data science', 'python data science tutorial', 'codebasics data science', 'data science python', 'python data science', 'data science playlist', 'data scientist course', 'data science tutorial python', 'data science using python']",en,False,UCh9nVJoWXmFb7sLApWGcLPQ,codebasics
LlD2hNyjjLg,Resume Tip: Concrete Proof Over a Vague Claim,2022-06-27T15:00:13Z,9342,351,4,PT44S,hd,"['yt:cc=on', 'how to write a resume', 'best resume tips', 'resume tips', 'how to make a resume', 'how to make a resume on word', 'resume tip for work proof', 'work proof for resume', 'resume', 'how to show work on resume', 'proof over a vague claim', 'proof vs vague claim']",en,False,UCh9nVJoWXmFb7sLApWGcLPQ,codebasics
kqVQDXfc9hU,15. Exception Handling [Python 3 Programming Tutorials],2019-05-08T04:51:05Z,73966,976,29,PT9M10S,hd,"['python exception handling', 'python exception', 'exception in python', 'exception handling in python', 'python try except exception', 'exception handling in python with examples', 'types of exception handling in python', 'exception handling python example', 'exception handling program in python', 'exception handling in python advanced', 'exception handling python 3', 'What is Exception Handling in Python', 'how to figure out the type of exception', 'handle the python exception', 'python basics exception']",en,False,UCh9nVJoWXmFb7sLApWGcLPQ,codebasics
tOuXgORsXJ4,Simple Explanation of GRU (Gated Recurrent Units) | Deep Learning Tutorial 37 (Tensorflow & Python),2021-02-21T15:00:12Z,93164,1905,31,PT8M15S,hd,"['yt:cc=on', 'gated recurrent unit explained', 'gated recurrent neural network', 'gated recurrent unit (gru)', 'gated recurrent unit vs lstm', 'gated recurrent unit tutorial', 'gru rnn explained', 'gru neural network explained', 'gated recurrent unit', 'gru architecture', 'recurrent neural network', 'what is gated recurrent unit', 'gru', 'gru deep learning', 'gated recurrent unit deep learning', 'gru lstm', 'lstm vs gru', 'lstm gru', 'gated recurrent units', 'gru rnn', 'gru neural network', 'lstm and gru']",en,False,UCh9nVJoWXmFb7sLApWGcLPQ,codebasics
yCDevFTNbC0,"What is Standard Deviation and Mean Absolute Deviation | Math, Statistics for data science, ML",2021-04-23T15:00:15Z,101340,2576,141,PT8M16S,hd,"['yt:cc=on', 'standard deviation and mean absolute deviation', 'mean absolute deviation', 'mean absolute deviation vs standard deviation', 'standard deviation vs mean absolute deviation', 'mean deviation and standard deviation', 'mean absolute deviation statistics', 'what is standard deviation', 'what does standard deviation tell you', 'what is a deviation', 'what is the meaning of standard deviation', 'what is deviation in statistics', 'what do you mean by standard deviation', 'standard deviation']",en,False,UCh9nVJoWXmFb7sLApWGcLPQ,codebasics
atYPhweJ7ao,"Bidirectional RNN | Deep Learning Tutorial 38 (Tensorflow, Keras & Python)",2021-02-28T15:00:16Z,52521,1145,39,PT5M50S,hd,"['yt:cc=on', 'bidirectional', 'bidirectional rnn', 'rnn', 'rnn deep learning', 'bidirectional lstm', 'bidirectional recurrent neural network', 'bidirectional nlp', 'bi directional rnn architecture', 'bi directional rnn deep learning', 'bi directional rnn', 'bi directional RNN keras', 'bidirectional rnn explained', 'tensorflow bidirectional rnn', 'deep learning bidirectional rnn', 'what is bidirectional rnn', 'deep learning rnn classification', 'tensorflow lstm bidirectional tutorial', 'tensorflow bidirectional tutorial']",en,False,UCh9nVJoWXmFb7sLApWGcLPQ,codebasics
q9oAZwhuUy4,Data Analyst vs Data Engineer vs Data Scientist,2020-02-01T15:11:47Z,169684,5115,276,PT10M52S,hd,"['data engineer vs data analyst', 'data scientist vs data analyst', 'data specialist vs data analyst', 'data analyst vs data scientist', 'data science vs data analytics', 'data analytics vs data science', 'data engineer vs data scientist', 'data analyst vs data engineer', 'data analyst vs data scientist vs data engineer', 'data engineer vs data analyst vs data scientist', 'difference between data science and data analytics', 'data analyst vs data engineer vs data scientist', 'data engineer']",en,False,UCh9nVJoWXmFb7sLApWGcLPQ,codebasics
hQwFeIupNP0,"What is Word2Vec? A Simple Explanation | Deep Learning Tutorial 41 (Tensorflow, Keras & Python)",2021-04-04T14:30:15Z,123206,3191,101,PT18M28S,hd,"['word2vec explained', 'word2vec', 'nlp word2vec', 'nlp word2vec tutorial', 'word2vec deep learning', 'word2vec python', 'word embeddings', 'word embedding', 'python word2vec', 'word embedding python', 'word2vec model', 'tensorflow word2vec', 'word2vec tensorflow', 'word2vec embeddings', 'word2vec keras', 'keras word2vec', 'word embedding effect', 'word2vec nlp', 'deep learning word2vec', 'word2vecs impleexplanation', 'word2vecs tensorflow', 'word2vec simple explanation', 'what is word2vec', 'word2vecs data science']",en,False,UCh9nVJoWXmFb7sLApWGcLPQ,codebasics
ru1qeDO_qrc,Data Analyst Project For Beginners (HR Analytics): 1 - Problem Statement,2022-09-05T15:30:14Z,81913,1150,37,PT2M45S,hd,"['yt:cc=on', 'data analysis project using power bi', 'data analyst project', 'power bi project', 'power bi projects for practice', 'data analyst projects', 'data analysis projects for beginners', 'data analytics project', 'data analyst projects for beginners', 'data analysis projects', 'codebasics power bi', 'data analyst real-time projects', 'power bi real time project', 'power bi project step by step', 'data analysis resume projects', 'data analytics resume projects', 'power bi project for resume']",en,False,UCh9nVJoWXmFb7sLApWGcLPQ,codebasics
fHw188SBb9k,7 Job Options After Learning Python | Python Career Opportunities,2022-12-09T14:00:07Z,72518,2115,72,PT11M16S,hd,"['yt:cc=on', 'python jobs for beginners', 'python jobs for freshers', 'python career opportunities', 'python career path', 'python career options', 'python jobs', 'python career', 'python career oppurtunities', 'career options after python', 'career option after python', 'python opportunities', 'python job opportunities', 'jobs after learning python', 'python jobs to pursue in 2023', 'career opportunities in python', 'job profiles in python', 'career option in python']",en,False,UCh9nVJoWXmFb7sLApWGcLPQ,codebasics
qowp6SQ9_Oo,"Vanishing and exploding gradients | Deep Learning Tutorial 35 (Tensorflow, Keras & Python)",2021-01-23T14:30:12Z,74917,1825,54,PT9M53S,hd,"['vanishing gradient problem in rnn', 'vanishing gradient descent', 'vanshing gradient', 'vanishing gradient', 'deep learning vanshing gradient', 'exploding gradient problem', 'exploding gradients', 'exploding gradient and vanishing gradient', 'vanishing deep learning', 'vanishing gradient neural network', 'vanishing gradient problem in neural networks', 'vanishing and exploding gradient problem', 'vanishing gradient problem keras', 'vanishing and exploding gradients', 'what is exploding gradients']",en,False,UCh9nVJoWXmFb7sLApWGcLPQ,codebasics
mrhccLHtyN4,Python Tutorial -  17. Class and Objects,2016-03-13T22:30:29Z,175708,2292,139,PT9M17S,hd,"['class in python', 'python classes', 'python classes and objects tutorial', 'python class tutorial', 'python object oriented programming', 'python object oriented programming tutorial', 'classes and objects in python', 'what is class in python', 'python tutorial', 'tutorial python 3', 'python beginner tutorial', 'python tutorial for beginners', 'python classes explained', 'python classes for beginners', 'python objects', 'python 3 object oriented programming']",,False,UCh9nVJoWXmFb7sLApWGcLPQ,codebasics
